id,article_url,title,author,type,category,subcategory,text,date,time,image_url,image_caption,author_bio,subtype
10,https://www.washingtonpost.com/news/monkey-cage/wp/2017/08/11/republicans-are-increasingly-antagonistic-toward-experts-heres-why-that-matters/,Republicans are increasingly antagonistic toward experts. Here’s why that matters.,Matt Motta,blog,Politics,Monkey Cage,"Since 2015, according to a new Pew Research Center poll, Republicans’ attitudes toward colleges and universities have become much more negative. The poll found that the number of Republicans who believe colleges have a “positive impact on the way things are going in the country” dropped from 54 percent in 2015 to 36 percent in 2017. Meanwhile, Democrats’ approval held constant at 72 percent. <br><br> Has that affected our politics? Several commentators have been asking that question: Has the right’s declining trust in academics, scientists and other experts — call it “anti-intellectualism” — influenced opinions about politics? <br><br> That’s what my new research looks into. Drawing on more than 40 years of survey data, I found that the answer is yes. You can find the new anti-intellectualism in the way candidates and political movements scoff at experts and their evidence — something we can see in public attitudes like the refusal to acknowledge human-caused climate change and support for politicians like Donald Trump. <br><br> A certain kind of populism distrusts intellectuals and experts <br><br> The historian Richard Hofstadter famously referred to Americans’ distrust and dislike of experts as a form of “anti-intellectualism.” Anti-intellectualism has been increasing in the United States since the mid-1990s, primarily among ideological conservatives, according to recent research. <br><br> Throughout U.S. history, politicians have attempted to capitalize on voters’ anti-intellectual attitudes. George Wallace, for example, frequently referred to college professors and judges as “pointy-headed intellectuals” during his third-party campaign for president in 1968. <br><br> More recently, Trump was regularly skeptical of and sometimes openly derisive toward experts a during  his 2016 presidential campaign. Brexit campaigners were similarly skeptical about European Union bureaucrats, even throwing Trump’s famous “You’re fired!” catchphrase at European economists. <br><br> How I did this research <br><br> Does such antagonism toward the experts win over the citizens who hold anti-intellectual attitudes? To answer this question, I analyzed four decades of survey data from two sources. <br><br> One is the General Social Survey (GSS), a representative sample of Americans that has been conducted roughly once every two years since 1972. I measured anti-intellectualism in this survey using a question that asked respondents whether they place a great deal, only some, or hardly any trust in the “scientific community.” <br><br> During the 1990s, conservatives started to distrust experts <br><br> From the early 1970s through early 1990s, I found little ideological divide on this question. In 1991, for example, 47 percent of liberals and 46 percent of conservatives expressed high levels of trust in the scientific community. By the mid-1990s, however, views began to diverge. In 2014, 53 percent of liberals and only 36 percent of conservatives held high levels of trust in the scientific community. <br><br> The second source is a four-wave national panel study collected during the 2016 general election by the University of Minnesota’s Center for the Study of Political Psychology (CSPP), via Survey Sampling International. I measured anti-intellectualism in this survey using a question developed by Eric Oliver and Wendy Rahn. They asked more than 3,500 respondents how much they agreed or disagreed with this statement: “I would rather place my trust in the opinions of ordinary people than the opinions of experts and intellectuals.” <br><br> Here, too, I found significant differences between liberals and conservatives. In 2016, liberals earned an average score of 2.14 on the 0 to 4 point scale — in which zero meant strongly disagreeing that the opinions of ordinary people should be trusted over experts, and four meant strongly agreeing with that statement — while conservatives averaged about 2.42. The difference between the groups is a statistically significant 9 percent. <br><br> In each dataset, I assess the relationship between anti-intellectualism and the public’s political opinions using regression modeling. These models control for several other factors that might influence respondents’ political attitudes, such as partisanship, education and other basic demographics. <br><br> Anti-intellectual Americans were more likely to prefer anti-expert politicians like Wallace or Trump  <br><br> Respondents who were more anti-intellectual were more likely to support candidates who spoke skeptically about experts. In the 1972 GSS, approximately 22 percent of those who “hardly trusted” the scientific community were likely to vote for George Wallace in 1968, compared with only 12 percent of those who placed “a great deal” of trust in experts. <br><br> I found a similar pattern among those who supported or opposed Donald Trump. In the CSPP study, respondents rated Trump and Hillary Clinton on scales ranging from 0 (very negative feelings toward a candidate) to 100 (very positive feelings). The difference between these two scales is known as a “comparative candidate evaluation,” or CCE, which I scaled to range from 0 (favoring Clinton over Trump) to 1 (favoring Trump over Clinton). <br><br> In July, those who strongly felt that expert opinions were less trustworthy than ordinary people’s were more likely to prefer Trump, with an average 0.49 CCE rating; those who strongly disagreed that experts were less trustworthy than ordinary people were more likely to prefer Clinton, with a 0.44 CCE rating. That’s about a 5 percentage-point difference between groups — and it grew to about 8 points among those questioned in in October, with 0.51 and 0.43 CCE, respectively. <br><br> Does being wary of experts lead people to support Trump, or does supporting Trump lead people to be wary of experts? Because the CSPP data interviewed the same respondents a number of times over the course of the election, I was able to use more complex statistical procedures to investigate whether anti-intellectual attitudes increased support for Trump, or vice versa. I found that that anti-intellectual attitudes led voters to support Trump, and not the other way around. <br><br> Attacking science, experts and professors can help get politicians elected <br><br> Anti-intellectualism may influence how politicians campaign in upcoming election cycles. My research shows that politicians can successfully earn support by calling into question not only scientific consensus, but those who produce it. Attacking scientists, college professors and other experts can be a politically useful strategy for those hoping to win over the support of people who hold anti-intellectual attitudes. <br><br> And elections, of course, have consequences. If politicians who deride experts win political office, they may take action consistent with those views once elected. For example, Trump did dismiss EPA science advisers and pull out of the Paris climate agreement — which may increase global carbon emissions, and also help win support on the 2020 campaign trail. <br><br> Matt Motta is a PhD candidate at the University of Minnesota. Find him on Twitter @matt_motta. <br><br>",11/08/2017,5:00:38,https://img.washingtonpost.com/rw/2010-2019/WashingtonPost/2017/05/18/Interactivity/Images/AP_120215150406.jpg,"Roger Ailes, left, and Bill O’Reilly at the Hollywood Reporter 35 Most Powerful People in Media event in 2012. (AP Images for The Hollywood Reporter) <br><br>",Some String,standalone
9,https://www.washingtonpost.com/news/post-politics/wp/2017/08/11/trump-retweets-fox-headlines-about-fallout-for-republicans-who-cross-him/,Trump retweets Fox headlines about ‘fallout’ for Republicans who cross him,John Wagner,blog,Politics,Post Politics,"President Trump showed no interest Friday in backing off his feud with Senate Republicans, even as some in his own party warned he could be undermining his agenda on Capitol Hill. <br><br> Taking to Twitter, Trump retweeted a pair of “Fox & Friends” headlines recounting his rhetorical battle with Senate Majority Leader Mitch McConnell (R-Ky.) and other member of the GOP caucus. <br><br> “Senators learn the hard way about the fallout from turning on Trump,” read the first headline. <br><br> The second: “Trump fires new warning shot at McConnell, leaves door open on whether he should step down.” <br><br> The president has been smarting from the Senate’s failure to pass an overhaul of the Affordable Care Act, a long-standing priority for the GOP and a marquee campaign promise from Trump last year. <br><br> In a series of tweets and public statements in recent days, Trump has taken shots at McConnell for comments earlier this week suggesting that Trump’s lack of political experience had led to “excessive expectations” for passing major legislation. <br><br> Speaking to reporters Thursday afternoon, Trump declined to say whether McConnell should resign. But Trump said they should ask the question again if the Senate leader doesn’t deliver on the president’s leading priorities. Besides a health-care bill, those include tax cuts and new infrastructure spending. <br><br> One of the Fox News stories amplified by Trump on Twitter on Friday notes that two GOP senators who’ve spoken out against Trump and his policies — Sen. Jeff Flake (Ariz.) and Dean Heller (Nev.) — have now drawn primary challenges. <br><br> “Republican senators who have been a thorn in President Trump's side are beginning to see the political consequences of opposing the White House as pro-Trump activists start to mobilize,” says the story retweeted by the president. <br><br> In the wake of Trump’s comments on Thursday, several Republicans said his words could instead backfire, making it more difficult to get his agenda passed on Capitol Hill, where McConnell is a key figure and still popular among fellow GOP senators. So far, Republicans have achieved few major legislative victories, despite control of the White House and both chambers of Congress. <br><br>",11/08/2017,6:44:07,https://img.washingtonpost.com/rw/2010-2019/WashingtonPost/2017/08/11/National-Politics/Images/2017-08-10T203022Z_1530187075_RC11CC1CDC60_RTRMADP_3_NORTHKOREA-MISSILES-TRUMP.jpg,"President Trump speaks to reporters at Trump's golf club in Bedminster, N.J., on Thursday. (Photo by Jonathan Ernst/Reuters) <br><br>",John Wagner is a national political reporter covering the White House. <br><br>,standalone
8,https://www.washingtonpost.com/powerpost/progressives-are-building-outside-of-the-democratic-party-to-win-in-2018/2017/08/12/689ec374-7ed1-11e7-83c7-5bd5460f0d7e_story.html,Progressives are building outside of the Democratic Party to win in 2018,David Weigel,article,Politics,PowerPost,"ATLANTA — When Sen. Elizabeth Warren (D-Mass.) mentioned President Trump during a Saturday morning speech, the more than 1,000 activists at the progressive Netroots Nation conference booed. <br><br> But when she mentioned a “so-called Democratic strategist” who wanted her party to move to the center, the boos rang even louder. <br><br> “Apparently, the path forward is to go back to locking up nonviolent drug offenders and ripping more holes in our economic safety net,” Warren said sarcastically, in a Saturday morning speech. “We’re not going back to the days when universal health care was something Democrats talked about on the campaign trail but were too chicken to fight for after they got elected.” <br><br> Warren’s party, locked out of power in Washington and most of the country, has spent 2017 opposing Trump while also fighting about what it really stands for. Both trends were on display at Netroots, as huddles over how to block Republican bills alternated with protests of Democrats who were seen to be belittling black candidates, LGBT rights or Native Americans. <br><br> The evidence from Atlanta suggested that Democrats might march into 2017 and 2018 elections still arguing about how to win — without dividing the party. <br><br> The high-profile problems of the Democratic National Committee were part of that discussion, but the larger focus was about what progressives were building outside the party, untainted by the Democratic brand. Just as the tea party complemented the work of the Obama-era GOP, progressives want to build organizations, national and hyperlocal, to turn out voters who might be turned off by Democrats. <br><br> “Ninety percent of Americans think that the Republicans put corporations ahead of American citizens, and 80 percent say that the Democratic Party does,” said Tom Steyer, whose political advocacy group NextGen America had already budgeted $8 million for 2018 election turnout operations. “For people under the age of 30, I’ve seen data on how 44 percent of them thought there was no difference between Hillary Clinton and Donald Trump on the issues. I mean, that's insane.” <br><br> The 12th annual Netroots Nation conference, which was the first to immediately follow a Democratic loss in a presidential election, revealed the scope of what Barack Obama’s White House once deemed “the professional left.” The Working Families Party, which began in New York and grew across the Northeast and Midwest, announced new state chapters. Activists organized under the Indivisible handbook, a guide created by former congressional staffers with advice on how to pressure their bosses, taught short sessions on how they organized rural campaigns — some which lost, all of which would continue into 2018. <br><br> MoveOn.org, fresh off organizing protests to save the Affordable Care Act from repeal, was promoting a “Resistance Summer” in which thousands of activists would talk to their neighbors about progressive politics. Our Revolution, the group founded by Sen. Bernie Sanders (I-Vt.) after his 2016 presidential bid, promoted its own “Summer of Progress” — activists getting congressional Democrats on record behind eight left-wing bills designed to ease voter registration, create universal health insurance, raise the minimum wage to $15, and reform the criminal justice system. <br><br> The Democrats who came to Atlanta to meet potential supporters often had more positive things to say about the activists than about their party. Andrew Gillum, the mayor of Tallahassee now running for governor of Florida, framed his own campaign as a challenge to an establishment that seemed to specialize in losing elections. <br><br> “A lot of people are hugely suspect of the organized party, and they question whether or not the will of the people will truly be felt without the influence of party poobahs,” Gillum said. “In the past, those leaders galvanized, they chose, they cleared the field, and our voters weren’t on the same page as them. The fate we suffered was 20 years of Republican leadership in Florida.” <br><br> The Democratic National Committee itself had a minor presence at the conference. DNC Vice Chairman Keith Ellison, a congressman from Minnesota who lost a progressive-backed bid for chairman, was on hand to defend the party’s 2016 platform and its “Better Deal” economic policies. <br><br> It was not an easy sell. At a Friday panel, Ellison visibly sighed when one activist lectured him on why she had joined the Green Party after Sanders’s defeat, and after a Native American activist said his use of the term “nation of immigrants” had been offensive. Ellison’s advice was not to defend the Democrats but to influence them from the grass roots until the party changed. <br><br> “It’s not moral, and it’s not just, but it’s reality,” Ellison said. <br><br> The DNC also dispatched Raffi Krikorian, the party’s new chief technological officer, who arrived this year from Uber and Twitter. He told activists that the DNC’s innovations and data would be more available than under the old regime. For some, however, the DNC was an afterthought; asked about the DNC’s data operation, Steyer of NextGen laughed and said the organization had its own, superior analytics for turning out votes. <br><br> Candidates from Georgia and elsewhere, who had watched their parties collapse in the final years of the Obama presidency, often sounded a lot like Steyer. In a Politico column that ran shortly before the conference, former Sanders digital fundraising manager Michael Whitney suggested that the DNC faced a donor crisis. Despite bear-hugging the “resistance” movement, the DNC had raised just half as much money as the Republican National Committee in 2017 — $38 million to $75 million — and lagged almost as badly among donors giving less than $200 apiece. <br><br> “Republicans have quietly taken a decisive edge over Democrats when it comes to small-dollar fundraising,” wrote Whitney. <br><br> At Netroots, there was little worry about Democratic fundraising, apart from the structural advantage that wealthy donors earned from the 2010 Citizens United decision. <br><br> The metric on which they focused: donations to individual campaigns. Randy Bryce, an ironworker running against House Speaker Paul D. Ryan (R-Wis.), said that more than 28,000 people had donated to his bid since it began in June. Georgia state Rep. Stacey Abrams, a candidate for governor, emphasized the work she had done through the New Georgia Project, a third-party group, to register voters. <br><br> “Because we’ve been under Republican control for so long, we do not have the robust infrastructure that other states have,” said Abrams of the Georgia effort. “The competition existed much more acutely when we [Democrats] had more resources. We’ll come together; there are much more skirmishes than actual battles.” <br><br> Not all battles were created equal. There was almost no discussion about the party’s potential candidates in the 2020 presidential election; when Warren made a reference to putting a woman in the Oval Office, the cheers of “Run, Warren, Run” were scattered and brief. <br><br> At a panel on what 2017’s special elections had taught Democrats about the upcoming midterms, defeated Georgia candidate Jon Ossoff repeatedly criticized the “hot take” media culture for suggesting that arguments about policy were holding Democrats back. <br><br> “Get offline and go knock on doors,” Ossoff said. “Democrats are united, no matter what you hear on cable news or in the hot takes … we don’t have to beat ourselves up over the fact that there’s a range of views and strategies. Let’s get on with it, and take back the House.” <br><br>",12/08/2017,16:52:32,https://img.washingtonpost.com/rw/2010-2019/WashingtonPost/2017/08/12/Others/Images/2017-08-12/170812_wp_netroots_1369.jpg,Mikey Franklin of the District wears a custom shirt he had made at the Netroots Nation conference in Atlanta on Saturday.  (Kevin D. Liles/For the Washington Post) <br><br>,"David Weigel is a national political correspondent covering Congress and grassroots political movements. He's the author of ""The Show That Never Ends,"" a history of progressive rock music. <br><br>",standalone
